{
  "$schema": "http://json-schema.org/draft-07/schema#",
  "title": "GeoView Swiper Config Schema",
  "type": "object",
  "version": 1.1,
  "comments": "Configuration for GeoView swiper package.",
  "additionalProperties": false,

  "properties": {
    "orientation": {
      "type": "string",
      "enum": ["vertical", "horizontal"],
      "description": "Orientation of the swiper bar.",
      "default": "vertical"
    },
    "keyboardOffset": {
      "type": "number",
      "minimum": 10,
      "maximum": 100,
      "description": "The offset value when swiper is moved from the keyboard.",
      "default": 10
    },
    "interactive": {
      "type": "boolean",
      "description": "When true, users can add/remove layers from the swiper and choose the revealed side directly from the layer settings panel. When false, the swiper stays static.",
      "default": false
    },
    "layers": {
      "type": "array",
      "description": "The layers participating in the swiper, each with the side of the bar on which the layer is revealed.",
      "items": {
        "type": "object",
        "additionalProperties": false,
        "properties": {
          "layerPath": {
            "type": "string",
            "description": "The layer path participating in the swiper."
          },
          "side": {
            "type": "string",
            "enum": ["left", "right", "up", "down"],
            "description": "The visible side of the swiper bar for this layer. Use left/right for a vertical bar and up/down for a horizontal bar.",
            "default": "left"
          }
        },
        "required": ["layerPath", "side"]
      }
    },
    "version": {
      "type": "string",
      "enum": ["1.1"],
      "description": "The schema version used to validate the configuration file. The schema should enumerate the list of versions accepted by this version of the viewer."
    }
  },
  "required": ["orientation", "layers"]
}
