{
  "orientation": "vertical",
  "keyboardOffset": 10,
  "interactive": true,
  "layers": [
    { "layerPath": "swipe0/0", "side": "left" },
    { "layerPath": "swipe1/msi-94-or-more", "side": "left" },
    { "layerPath": "swipe4/polygons.json", "side": "left" },
    { "layerPath": "swipe5/ec-msc:CURRENT_CONDITIONS", "side": "left" },
    { "layerPath": "swipe6/lakes", "side": "left" },
    { "layerPath": "ccc75c12-5acc-4a6a-959f-ef6f621147b9/0", "side": "left" }
  ]
}
